{
  "documentId": "stack",
  "documentType": "Coding",
  "schemaRef": "CodingSchema/v1",
  "codingKind": "tech-stack",
  "status": "ACTIVE",
  "tags": ["stack:python", "arch:hexagonal"],
  "content": {
    "title": { "blockType": "Title", "title": "stack" },
    "language": { "blockType": "Language", "title": "実装言語", "value": "python" },
    "architecture": {
      "blockType": "Architecture",
      "title": "アーキテクチャ",
      "architecture": "hexagonal",
      "framework": "none",
      "orm": "none"
    },
    "integrations": {
      "blockType": "Integrations",
      "title": "ライブラリ束縛",
      "items": [
        { "capability": "schema-validation", "library": "jsonschema", "version": "4.x" },
        { "capability": "code-scan", "library": "ripgrep", "version": "14.x" }
      ]
    },
    "infrastructure": {
      "blockType": "Infrastructure",
      "title": "共通インフラ能力",
      "items": [
        { "capability": "cli", "library": "typer", "version": "0.12.x" },
        { "capability": "mcp", "library": "fastmcp", "version": "2.x" },
        { "capability": "logging", "library": "(stdlib logging)", "version": "-" },
        { "capability": "filesystem", "library": "(stdlib pathlib)", "version": "-" },
        { "capability": "error-handling", "library": "(custom Result)", "version": "-" }
      ]
    }
  }
}
